Task / Problems:
1) Create the table Member, Books and Issue without any constraints as
mentioned in the schema description above.

mysql> use septjp25;
Database changed

mysql> create table Member(Member_id int ,Member_Name varchar(30) , Member_address varchar(50) , Acc_Open_Date date , Membership_type varchar(20) , Fees_paid int  , Max_Books_Allowed int , penalty_Amount decimal(7,2));
Query OK, 0 rows affected (0.05 sec)

mysql> create table Bookk(Book_No int , Member_id int ,issue_date date ,Return_date date );
Query OK, 0 rows affected (0.09 sec)

mysql> create table Issue (Lib_issue_id int , Book_No int , Member_Id int , issue_Date date , Return_date date );
Query OK, 0 rows affected (0.08 sec)


2) View the structure of the tables.

mysql> desc Member;
+-------------------+--------------+------+-----+---------+-------+
| Field             | Type         | Null | Key | Default | Extra |
+-------------------+--------------+------+-----+---------+-------+
| Member_id         | int          | YES  |     | NULL    |       |
| Member_Name       | varchar(30)  | YES  |     | NULL    |       |
| Member_address    | varchar(50)  | YES  |     | NULL    |       |
| Acc_Open_Date     | date         | YES  |     | NULL    |       |
| Membership_type   | varchar(20)  | YES  |     | NULL    |       |
| Fees_paid         | int          | YES  |     | NULL    |       |
| Max_Books_Allowed | int          | YES  |     | NULL    |       |
| penalty_Amount    | decimal(7,2) | YES  |     | NULL    |       |
+-------------------+--------------+------+-----+---------+-------+
8 rows in set (0.05 sec)

mysql> desc Bookk;
+-------------+------+------+-----+---------+-------+
| Field       | Type | Null | Key | Default | Extra |
+-------------+------+------+-----+---------+-------+
| Book_No     | int  | YES  |     | NULL    |       |
| Member_id   | int  | YES  |     | NULL    |       |
| issue_date  | date | YES  |     | NULL    |       |
| Return_date | date | YES  |     | NULL    |       |
+-------------+------+------+-----+---------+-------+
4 rows in set (0.05 sec)


mysql> desc Issue;
+--------------+------+------+-----+---------+-------+
| Field        | Type | Null | Key | Default | Extra |
+--------------+------+------+-----+---------+-------+
| Lib_issue_id | int  | YES  |     | NULL    |       |
| Book_No      | int  | YES  |     | NULL    |       |
| Member_Id    | int  | YES  |     | NULL    |       |
| issue_Date   | date | YES  |     | NULL    |       |
| Return_date  | date | YES  |     | NULL    |       |
+--------------+------+------+-----+---------+-------+
5 rows in set (0.00 sec)


3) Drop the Member table

mysql> drop table Member;
Query OK, 0 rows affected (0.09 sec)


4) Create the table Member again as per the schema description with the
following constraints.
a. Member_Id – Primary Key
b. Membership_type - ‘Lifetime’,’ Annual’, ‘Half Yearly’,’ Quarterly’


mysql> create table Member(Member_id int primary key,
                           Member_Name varchar(30) ,
                           Member_address varchar(50) , 
                           Acc_Open_Date date , 
                           Membership_type varchar(20) check(Membership_type in ("lifetime","Annual","Half yearly","Quarterly")) ,
                           Fees_paid int  , 
                           Max_Books_Allowed int ,
                           penalty_Amount decimal(7,2));
Query OK, 0 rows affected (0.07 sec)


5) Modify the table Member increase the width of the member name to 30
characters.

mysql> alter table Member
    -> modify column Member_Name varchar(60);
Query OK, 0 rows affected (0.07 sec)
Records: 0  Duplicates: 0  Warnings: 0


6) Add a column named as Reference of Char(30) to Issue table.

mysql> alter table Issue
    -> add column Reference char(30) ;
Query OK, 0 rows affected (0.11 sec)
Records: 0  Duplicates: 0  Warnings: 0

7) Delete/Drop the column Reference from Issue.

mysql> alter table Issue
    -> Drop column Reference;
Query OK, 0 rows affected (0.11 sec)
Records: 0  Duplicates: 0  Warnings: 0


8) Rename the table Issue to Lib_Issue.

mysql> rename table Issue to Lib_Issue;
Query OK, 0 rows affected (0.07 sec)

 
9) Insert following data in table Member
Member

mysql> insert into Member (Member_id , Member_Name , Member_address, Acc_Open_Date,Membership_type, Fees_paid,Max_Books_Allowed,penalty_Amount)values
                           (1,"Richa" , "Pune","10/12/05" , "lifetime" ,25000,5,50),
                           (2,"Garima sen","Pune","26/6/1","Annual",1000,3,Null);

Query OK, 2 rows affected, 2 warnings (0.07 sec)
Records: 2  Duplicates: 0  Warnings: 2

10) Modify the column Member_name. Decrease the width of the member
name to 20 characters. (If it does not allow state the reason for that)

mysql> alter table Member
    -> modify column Member_Name varchar(20);
Query OK, 2 rows affected (0.07 sec)
Records: 2  Duplicates: 0  Warnings: 0

13) Generate another table named Member101 using a Create command
along with a simple SQL query on member table.

mysql> create table Member101 as select * from Member;
Query OK, 3 rows affected (0.11 sec)
Records: 3  Duplicates: 0  Warnings: 0

14) Add the constraints on columns max_books_allowed and penalty_amt
as follows
a. max_books_allowed < 100
b. penalty_amt maximum 1000
Also give names to the constraints.



16) Create table Books again as per the schema description with the
following constraints.
a. Book_No – Primary Key
b. Book_Name – Not Null
c. Category – System, Fiction, Database, RDBMS, Others.

CREATE TABLE Books (
    Book_No INT,
    Book_Name VARCHAR(50) NOT NULL,
    Category VARCHAR(20),
    
    CONSTRAINT pk_book_no PRIMARY KEY (Book_No),
    CONSTRAINT chk_category 
        CHECK (Category IN ('System', 'Fiction', 'Database', 'RDBMS', 'Others'))
);


17) Insert data in Book table as follows:



12) Try to insert a record with Max_Books_Allowed = 110, Observe the
error that comes.

mysql> alter table bookk
    -> add column author varchar
    -> (20) after Book_Name ;
Query OK, 0 rows affected (0.12 sec)
Records: 0  Duplicates: 0  Warnings: 0

mysql> alter table bookk
    -> add column cost int after author ;
Query OK, 0 rows affected (0.09 sec)
Records: 0  Duplicates: 0  Warnings: 0

mysql> insert into bookk (Book_no , Book_Name , author,cost,Category) values
    ->                      (101,"Let us c ","Denis" , 450 , "system" ),
    ->                       (102 , "Oracle- Complete Ref ","Loni",550,"database"),
    ->                        (103 , "Mastering SQl " , "Loni" , 250 , "database"),
    ->                        (104,"pl Sql-Ref","scott urman",750,"database");
Query OK, 4 rows affected, 1 warning (0.04 sec)
Records: 4  Duplicates: 0  Warnings: 1

19) View the data in the tables using simple SQL query.

mysql> table bookk;
+---------+----------------------+-------------+------+----------+
| Book_no | Book_Name            | author      | cost | Category |
+---------+----------------------+-------------+------+----------+
|     101 | Let us c             | Denis       |  450 | system   |
|     102 | Oracle- Complete Ref | Loni        |  550 | database |
|     103 | Mastering SQl        | Loni        |  250 | database |
|     104 | pl Sql-Ref           | scott urman |  750 | database |
+---------+----------------------+-------------+------+----------+
4 rows in set (0.00 sec)

20) Insert into Book following data.

105, National Geographic, Adis Scott, 1000, Science

mysql> insert into bookk values(105,"National Geographic","Adis Scott",1000,"science");
ERROR 3819 (HY000): Check constraint 'bookk_chk_1' is violated.

21) Rename the table Lib_Issue to Issue.
mysql> rename table lib_issue to issue;
Query OK, 0 rows affected (0.15 sec)

22) Drop table Issue.
mysql> drop table issue;
Query OK, 0 rows affected (0.02 sec)

23) As per the given structure Create table Issue again with following
constraints.

 Lib_Issue_Id-Primary key
 Book_No- foreign key
 Member_id - foreign key
 Issue_date
 Return_date

mysql> create table issue (lib_issue_id int primary key , Book_no int , member_id int,issue_date date , return_date date );
Query OK, 0 rows affected (0.07 sec)

mysql> alter table issue
    -> add foreign key (Book_no )
    -> references bookk(Book_no),
    -> add foreign key (member_id )
    -> references member(Member_id);
Query OK, 0 rows affected (0.23 sec)
Records: 0  Duplicates: 0  Warnings: 0

24) Insert following data into Issue table.
mysql> INSERT INTO issue (lib_issue_id, Book_no, member_id, issue_date)
    -> VALUES
    -> (7001,101,1,'2006-12-10'),
    -> (7002,102,2,'2006-12-25'),
    -> (7003,104,1,'2006-01-15'),
    -> (7004,104,2,'2006-11-15');
Query OK, 4 rows affected (0.05 sec)
Records: 4  Duplicates: 0  Warnings: 0


mysql> table issue;
+--------------+---------+-----------+------------+-------------+
| lib_issue_id | Book_no | member_id | issue_date | return_date |
+--------------+---------+-----------+------------+-------------+
|         7001 |     101 |         1 | 2006-12-10 | NULL        |
|         7002 |     102 |         2 | 2006-12-25 | NULL        |
|         7003 |     104 |         1 | 2006-01-15 | NULL        |
|         7004 |     104 |         2 | 2006-11-15 | NULL        |
+--------------+---------+-----------+------------+-------------+
4 rows in set (0.00 sec)

26) Insert a record in Issue table. The member_id should not exist in

member table.

mysql> alter table issue
    -> drop constraint issue_ibfk_1;
Query OK, 0 rows affected (0.08 sec)
Records: 0  Duplicates: 0  Warnings: 0


26) Insert a record in Issue table. The member_id should not exist in

mysql> insert into issue
    -> (lib_issue_id,Book_no,member_id,issue_date)values
    -> values(7005 , 105,3,"2006-11-10");
ERROR 1064 (42000): You have an error in your SQL syntax; check the manual that corresponds to your MySQL server version for the right syntax to use near 'values(7005 , 105,3,"2006-11-10")' at line 3



29) Try to delete the record of member id 1 from member table and

observe the error .

ysql> delete from member where Member_id = 1;
ERROR 1451 (23000): Cannot delete or update a parent row: a foreign key constraint fails (`septjp25`.`issue`, CONSTRAINT `issue_ibfk_2` FOREIGN KEY (`member_id`) REFERENCES `member` (`Member_id`))


30) View the data and structure of all the three tables Member,

Issue, Book.

mysql> table member;
+-----------+-------------+----------------+---------------+-----------------+-----------+-------------------+----------------+
| Member_id | Member_Name | Member_address | Acc_Open_Date | Membership_type | Fees_paid | Max_Books_Allowed | penalty_Amount |
+-----------+-------------+----------------+---------------+-----------------+-----------+-------------------+----------------+
|         1 | Richa       | Pune           | 2010-12-05    | lifetime        |     25000 |                 5 |          50.00 |
|         2 | Garima sen  | Pune           | 2026-06-01    | Annual          |      1000 |                 3 |           NULL |
|       201 | Ramesh      | NULL           | NULL          | NULL            |      NULL |              NULL |           NULL |
+-----------+-------------+----------------+---------------+-----------------+-----------+-------------------+----------------+
3 rows in set (0.00 sec)

mysql> table issue;
+--------------+---------+-----------+------------+-------------+
| lib_issue_id | Book_no | member_id | issue_date | return_date |
+--------------+---------+-----------+------------+-------------+
|         7001 |     101 |         1 | 2006-12-10 | NULL        |
|         7002 |     102 |         2 | 2006-12-25 | NULL        |
|         7003 |     104 |         1 | 2006-01-15 | NULL        |
|         7004 |     104 |         2 | 2006-11-15 | NULL        |
+--------------+---------+-----------+------------+-------------+
4 rows in set (0.00 sec)

mysql> table bookk;
+---------+----------------------+-------------+------+----------+
| Book_no | Book_Name            | author      | cost | Category |
+---------+----------------------+-------------+------+----------+
|     101 | Let us c             | Denis       |  450 | system   |
|     102 | Oracle- Complete Ref | Loni        |  550 | database |
|     103 | Mastering SQl        | Loni        |  250 | database |
|     104 | pl Sql-Ref           | scott urman |  750 | database |
+---------+----------------------+-------------+------+----------+
4 rows in set (0.00 sec)


31) Modify the Return_Date of 7004,7005 to 15 days after the

Issue_date.
mysql> update issue
    -> set return_date= adddate(issue_date,15)
    -> where lib_issue_id in(7004,7005);
Query OK, 1 row affected (0.05 sec)
Rows matched: 1  Changed: 1  Warnings: 0

mysql> table issue;
+--------------+---------+-----------+------------+-------------+
| lib_issue_id | Book_no | member_id | issue_date | return_date |
+--------------+---------+-----------+------------+-------------+
|         7001 |     101 |         1 | 2006-12-10 | NULL        |
|         7002 |     102 |         2 | 2006-12-25 | NULL        |
|         7003 |     104 |         1 | 2006-01-15 | NULL        |
|         7004 |     104 |         2 | 2006-11-15 | 2006-11-30  |
+--------------+---------+-----------+------------+-------------+
4 rows in set (0.00 sec)



32) Remove all the records from Issue table where member_ID is 1
and Issue date in before 10-Dec-06.

mysql> DELETE FROM issue
    -> WHERE member_id = 1
    ->   AND issue_date < '2006-12-10';
Query OK, 1 row affected (0.05 sec)

33) Remove all the records from Book table with category other
than RDBMS and Database.

mysql> delete from bookk where category not in ("RDBMS" , "Database");
Query OK, 1 row affected (0.05 sec)

34) Remove the table Member.
mysql> DROP TABLE member;
ERROR 3730 (HY000): Cannot drop table 'member' referenced by a foreign key constraint 'issue_ibfk_2' on table 'issue'.

35) Remove the table Book.

